{
  "schema_version": "1.0",
  "corpus_repository": "anavvanzin/iconocracy-corpus",
  "corpus_commit": "d5f8ad1d5eaf039f3837d13ad3eb6ef38dedf2b7",
  "items": [
    {
      "canonical_id": "BR-001",
      "legacy_record_id": "BR-001",
      "legacy_ids": [],
      "source_url": "https://brasilianafotografica.bn.gov.br/brasiliana/handle/20.500.12156.1/11778",
      "editorial_status": "published",
      "grandfathered": true,
      "slug": "br-001",
      "image": {
        "path": "assets/acervo/BR-001.webp",
        "source_url": "https://brasilianafotografica.bn.gov.br/brasiliana/bitstream/handle/20.500.12156.1/11778/0000001.JPG.jpg?sequence=3&isAllowed=y",
        "catalog_url": "https://brasilianafotografica.bn.gov.br/brasiliana/handle/20.500.12156.1/11778",
        "license": "Public access",
        "credit": "Museu Histórico Nacional",
        "alt": "Estátua feminina na abertura da amostra dos produtos do Rio Grande do Sul"
      }
    },
    {
      "canonical_id": "BR-002",
      "legacy_record_id": "BR-002",
      "legacy_ids": [],
      "source_url": "https://brasilianafotografica.bn.gov.br/brasiliana/handle/20.500.12156.1/13609",
      "editorial_status": "published",
      "grandfathered": true,
      "slug": "br-002",
      "image": {
        "path": "assets/acervo/BR-002.webp",
        "source_url": "https://brasilianafotografica.bn.gov.br/brasiliana/bitstream/handle/20.500.12156.1/13609/GV%20dvft%20004%20-%20Visita%20de%20Get%c3%balio%20a%20Bel%c3%a9m%20do%20Par%c3%a1%20Out19400000095.JPG.jpg?sequence=3&isAllowed=y",
        "catalog_url": "https://brasilianafotografica.bn.gov.br/brasiliana/handle/20.500.12156.1/13609",
        "license": "Public access",
        "credit": "Museu da República / IBRAM",
        "alt": "Detalhe do monumento à República, Praça da República, Belém"
      }
    },
    {
      "canonical_id": "BR-003",
      "legacy_record_id": "BR-003",
      "legacy_ids": [],
      "source_url": "https://brasilianafotografica.bn.gov.br/brasiliana/handle/20.500.12156.1/13611",
      "editorial_status": "published",
      "grandfathered": true,
      "slug": "br-003",
      "image": {
        "path": "assets/acervo/BR-003.webp",
        "source_url": "https://brasilianafotografica.bn.gov.br/brasiliana/bitstream/handle/20.500.12156.1/13611/GV%20dvft%20004%20-%20Visita%20de%20Get%c3%balio%20a%20Bel%c3%a9m%20do%20Par%c3%a1%20Out19400000097.JPG.jpg?sequence=3&isAllowed=y",
        "catalog_url": "https://brasilianafotografica.bn.gov.br/brasiliana/handle/20.500.12156.1/13611",
        "license": "Public access",
        "credit": "Museu da República / IBRAM",
        "alt": "Monumento à República, Praça da República, Belém (vista geral)"
      }
    },
    {
      "canonical_id": "BR-004",
      "legacy_record_id": "BR-004",
      "legacy_ids": [],
      "source_url": "https://brasilianafotografica.bn.gov.br/brasiliana/handle/20.500.12156.1/11529",
      "editorial_status": "published",
      "grandfathered": true,
      "slug": "br-004",
      "image": {
        "path": "assets/acervo/BR-004.webp",
        "source_url": "https://brasilianafotografica.bn.gov.br/brasiliana/bitstream/handle/20.500.12156.1/11529/002080RJ0118.jpg.jpg?sequence=2&isAllowed=y",
        "catalog_url": "https://brasilianafotografica.bn.gov.br/brasiliana/handle/20.500.12156.1/11529",
        "license": "Public access",
        "credit": "Instituto Moreira Salles (IMS)",
        "alt": "Jardim do Campo da Aclamação (Campo de Santana): estátuas do Outono e da Primavera"
      }
    },
    {
      "canonical_id": "BR-005",
      "legacy_record_id": "BR-005",
      "legacy_ids": [],
      "source_url": "https://archive.nyu.edu/handle/2451/61396",
      "editorial_status": "published",
      "grandfathered": true,
      "slug": "br-005",
      "image": {
        "path": "assets/acervo/BR-005.webp",
        "source_url": "https://upload.wikimedia.org/wikipedia/commons/2/27/D%C3%A9cio_Villares_-_A_Rep%C3%BAblica.jpg",
        "catalog_url": "https://archive.nyu.edu/handle/2451/61396",
        "license": "Public domain",
        "credit": "Museu Histórico Nacional",
        "alt": "Alegoria da República (Décio Villares)"
      }
    },
    {
      "canonical_id": "BR-006",
      "legacy_record_id": "BR-006",
      "legacy_ids": [],
      "source_url": "https://brasiliana.museus.gov.br/acervos/alegoria-da-republica/",
      "editorial_status": "published",
      "grandfathered": true,
      "slug": "br-006",
      "image": {
        "path": "",
        "source_url": "",
        "catalog_url": "https://brasiliana.museus.gov.br/acervos/alegoria-da-republica/",
        "license": "Public domain",
        "credit": "Museu Histórico Nacional",
        "alt": "Alegoria da República (Carlos Chambelland)"
      }
    },
    {
      "canonical_id": "BR-007",
      "legacy_record_id": "BR-007",
      "legacy_ids": [],
      "source_url": "http://memoria.bn.br/pdf/702390/per702390_1827_00060.pdf",
      "editorial_status": "published",
      "grandfathered": true,
      "slug": "br-007",
      "image": {
        "path": "",
        "source_url": "",
        "catalog_url": "http://memoria.bn.br/pdf/702390/per702390_1827_00060.pdf",
        "license": "Public domain",
        "credit": "Fundação Biblioteca Nacional",
        "alt": "As Estátuas Fallando (The Statues Speaking) — Justiça"
      }
    },
    {
      "canonical_id": "BR-008",
      "legacy_record_id": "BR-008",
      "legacy_ids": [],
      "source_url": "http://memoria.bn.br/docreader/webindex/WIPagina/313394/101306",
      "editorial_status": "published",
      "grandfathered": true,
      "slug": "br-008",
      "image": {
        "path": "",
        "source_url": "",
        "catalog_url": "http://memoria.bn.br/docreader/webindex/WIPagina/313394/101306",
        "license": "Public domain",
        "credit": "Fundação Biblioteca Nacional",
        "alt": "Estátua da Justiça (Luiz Rochet) — referência no Almanak Laemmert"
      }
    },
    {
      "canonical_id": "FR-001",
      "legacy_record_id": "FR-001",
      "legacy_ids": [],
      "source_url": "https://gallica.bnf.fr/ark:/12148/btv1b531737635",
      "editorial_status": "published",
      "grandfathered": true,
      "slug": "fr-001",
      "image": {
        "path": "assets/acervo/FR-001.webp",
        "source_url": "https://gallica.bnf.fr/iiif/ark:/12148/btv1b531737635/f1/full/1000,/0/native.jpg",
        "catalog_url": "https://gallica.bnf.fr/ark:/12148/btv1b531737635",
        "license": "Public domain",
        "credit": "Bibliothèque nationale de France",
        "alt": "La Justice, la Vengeance et la Vérité"
      }
    },
    {
      "canonical_id": "FR-002",
      "legacy_record_id": "FR-002",
      "legacy_ids": [],
      "source_url": "https://gallica.bnf.fr/ark:/12148/btv1b531737529",
      "editorial_status": "published",
      "grandfathered": true,
      "slug": "fr-002",
      "image": {
        "path": "assets/acervo/FR-002.webp",
        "source_url": "https://gallica.bnf.fr/iiif/ark:/12148/btv1b531737529/f1/full/1000,/0/native.jpg",
        "catalog_url": "https://gallica.bnf.fr/ark:/12148/btv1b531737529",
        "license": "Public domain",
        "credit": "Bibliothèque nationale de France",
        "alt": "Le triomphe de la Justice et de la Vérité"
      }
    },
    {
      "canonical_id": "FR-003",
      "legacy_record_id": "FR-003",
      "legacy_ids": [],
      "source_url": "https://gallica.bnf.fr/ark:/12148/btv1b53173732g",
      "editorial_status": "published",
      "grandfathered": true,
      "slug": "fr-003",
      "image": {
        "path": "assets/acervo/FR-003.webp",
        "source_url": "https://gallica.bnf.fr/iiif/ark:/12148/btv1b53173732g/f1/full/1000,/0/native.jpg",
        "catalog_url": "https://gallica.bnf.fr/ark:/12148/btv1b53173732g",
        "license": "Public domain",
        "credit": "Bibliothèque nationale de France",
        "alt": "L'envoyé de la Justice"
      }
    },
    {
      "canonical_id": "FR-004",
      "legacy_record_id": "FR-004",
      "legacy_ids": [],
      "source_url": "https://gallica.bnf.fr/ark:/12148/btv1b10574064v",
      "editorial_status": "published",
      "grandfathered": true,
      "slug": "fr-004",
      "image": {
        "path": "assets/acervo/FR-004.webp",
        "source_url": "https://gallica.bnf.fr/iiif/ark:/12148/btv1b10574064v/f1/full/1000,/0/native.jpg",
        "catalog_url": "https://gallica.bnf.fr/ark:/12148/btv1b10574064v",
        "license": "Public domain",
        "credit": "Bibliothèque nationale de France",
        "alt": "Marianne enseignant l'alphabet à des enfants (naïades et Marianne)"
      }
    },
    {
      "canonical_id": "FR-005",
      "legacy_record_id": "FR-005",
      "legacy_ids": [],
      "source_url": "https://gallica.bnf.fr/ark:/12148/btv1b531842166",
      "editorial_status": "published",
      "grandfathered": true,
      "slug": "fr-005",
      "image": {
        "path": "assets/acervo/FR-005.webp",
        "source_url": "https://gallica.bnf.fr/iiif/ark:/12148/btv1b531842166/f1/full/1000,/0/native.jpg",
        "catalog_url": "https://gallica.bnf.fr/ark:/12148/btv1b531842166",
        "license": "Public domain",
        "credit": "Bibliothèque nationale de France",
        "alt": "La République aimable (Félicien Rops)"
      }
    },
    {
      "canonical_id": "FR-006",
      "legacy_record_id": "FR-006",
      "legacy_ids": [],
      "source_url": "https://gallica.bnf.fr/ark:/12148/btv1b8438243t",
      "editorial_status": "published",
      "grandfathered": true,
      "slug": "fr-006",
      "image": {
        "path": "assets/acervo/FR-006.webp",
        "source_url": "https://gallica.bnf.fr/iiif/ark:/12148/btv1b8438243t/f1/full/1000,/0/native.jpg",
        "catalog_url": "https://gallica.bnf.fr/ark:/12148/btv1b8438243t",
        "license": "Public domain",
        "credit": "Bibliothèque nationale de France",
        "alt": "The French Crisis: Madame La République"
      }
    },